{
  "schema_version": "1.0",
  "schema_url": ".ai/schema/context.schema.json",
  "project": {
    "name": "methodology",
    "kind": "methodology-source",
    "domain": "meta",
    "started_on": "2026-05-06"
  },
  "current_phase": {
    "stage": "stage-5-v0",
    "label": "검증·확장 — L0~L4 v0 흐름 완료, 실제 반복 friction 대기",
    "since": "2026-05-08"
  },
  "active_skeleton": null,
  "last_session": {
    "ended_at": "2026-05-07T15:05:26Z",
    "agent": {
      "model": "gpt-5",
      "tool": "codex-desktop",
      "version": "unknown"
    },
    "host_os": "darwin-26.4.1-arm64",
    "checkpoint_file": ".ai/checkpoint.md"
  },
  "must_read": [
    "ONBOARDING.md",
    "10_foundation/WHITEPAPER.md",
    "AGENTS.md",
    "HANDOFF.md",
    "TODO.md",
    ".ai/checkpoint.md"
  ],
  "must_read_optional": [
    "00_briefs/current/*.md",
    "README.md",
    "CLAUDE.md",
    "20_guides/00_AI_기획_프로젝트_운영_원칙.md",
    "20_guides/03_AI_관찰_로그_작성_규칙.md",
    "40_dev/snapshots/implementation-plan-2026-05-07.md",
    "40_dev/snapshots/transfer-drill-2026-05-08.md",
    "40_dev/snapshots/2026-05-07_handoff_simulation_baseline.md"
  ],
  "active_todos": [],
  "active_catalog_hits": [],
  "adapters_present": [
    "generic",
    "claude",
    "codex",
    "gpt"
  ]
}
